37. Kenai Fjords,"Kenai Fjords National Park, which is located in Alaska, preserves and protects the Harding Icefield, which is the largest icefield that is located entirely within the United States.Hiking and ice climbing on the Exit Glacier is a popular thing to do in this park, but Kenai Fjord is also one of the best US national parks for wildlife spotting. On land, you can see moose, black bears, brown bears, and wolves. Sea lions, seals, dolphins, humpback whales, orcas, sea otters, and fin whales can be spotted in the sea. In the sky, look for bald eagles, peregrine falcons, and tufted and horned puffins.",https://s27363.pcdn.co/wp-content/uploads/2022/06/Kenai-Fjords-Sea-Stacks.jpg.optimal.jpg,Alaska,"Hike the Harding Icefield Trail, go ice climbing or glacier hiking on the Exit Glacier, take a wildlife cruise, walk the Glacier Overlook Trail, go glacier kayaking, go fishing, or take a flightseeing tour.",May through September,https://www.earthtrekkers.com/kenai-fjords-np/
38. Kings Canyon,"Kings Canyon preserves a glacially carved valley (named Kings Canyon) and Grant Grove, which is home to General Grant, the second largest tree in the world.",https://s27363.pcdn.co/wp-content/uploads/2017/11/Kings-Canyon-Panoramic-Overlook.jpg.optimal.jpg,California,"Visit Grant Grove, drive the Kings Canyon Scenic Byway and visit Zumwalt Meadows.",May through October,https://www.earthtrekkers.com/one-day-itinerary-kings-canyon-and-sequoia-national-parks/
39. Kobuk Valley,"Kobuk Valley National Park is located to the west of Gates of the Arctic. This national park preserves the enormous Great Kobuk Sand Dunes and caribou migration routes.This park is located within the Arctic Circle, so like Gates of the Arctic, in early July, you can see the midnight sun. No roads lead into the park, so to get here, you will take a flight from a nearby town. It’s one of the least visited national parks in the USA, getting just a handful more visitors than Gates of the Artic.",https://s27363.pcdn.co/wp-content/uploads/2022/04/Kobuk-Valley.jpg.optimal.jpg,Alaska,"Go backpacking, boating, hiking, flightseeing, and wildlife watching in the summer months. You can also go hiking on the sand dunes.",May through September,
40. Lake Clark,"Lake Clark National Park protects an area of land that is almost 3 million acres. The park is named for Lake Clark, but this park also contains several active volcanoes, a temperate rainforest, numerous lakes and rivers, three mountain ranges, and a tundra plateau. It is also one of the best places in the USA to see brown bears.",https://s27363.pcdn.co/wp-content/uploads/2023/08/Lake-Clark-National-Park.jpg.optimal.jpg,Alaska,"Take a flightseeing tour, go fishing, rafting, hiking, kayaking, and camping. Visiting Proenneke’s Cabin on Upper Twin Lake is another popular activity.",June through September,https://www.earthtrekkers.com/lake-clark-national-park/
41. Lassen Volcanic,"This national park protects Lassen Peak, the largest plug dome volcano in the world. In Lassen Volcanic, you’ll see steaming fumaroles, pretty lakes, colorful landscapes, and Lassen Peak.",https://s27363.pcdn.co/wp-content/uploads/2022/04/Lassen-Volcanic-1.jpg.optimal.jpg,California,"Walk Bumpass Hell Trail, capture the reflection of Lassen Peak in Manzanita Lake, go for a scenic drive on Lassen Park Highway, visit Kings Creek Falls and Mill Creek Falls, visit Devils Kitchen and hike to the top of Lassen Peak.",July through October,
42. Mammoth Cave,"With over 400 miles of explored caves and passageways, Mammoth Cave is the world’s longest cave system. On a visit to Mammoth Cave, explore this subterranean world of immense rooms, long canyons, and tight passageways.",https://s27363.pcdn.co/wp-content/uploads/2022/04/Mammoth-Cave.jpg.optimal.jpg,Kentucky,"Take a ranger guided tour of the cave. Tours range from 30 minutes to 6 hours, depending on the tour and how much of the cave you want to explore.",All year,https://www.earthtrekkers.com/how-to-plan-your-visit-mammoth-cave-national-park/
43. Mesa Verde,"Located in southwestern Colorado, Mesa Verde National Park is one of the most unique national parks in the United States. This park preserves the ancient Puebloan cliff dwellings and archeological sites that are hundreds of years old. Short hikes, scenic drives, and viewpoints make the to-do list, but the best way to experience this park is to get up close with the cliff dwellings on a tour.",https://s27363.pcdn.co/wp-content/uploads/2021/03/Mesa-Verde-National-Park-photo.jpg.optimal.jpg,Colorado,"Take a ranger guided tour of a cliff dwelling, see the Spruce Tree House, hike the Petroglyph Point Trail, drive Mesa Top Loop, explore the Far View sites, and hike the Point Lookout Trail.","May through October, when the roads are open and you can tour the cliff dwellings.",https://www.earthtrekkers.com/best-things-to-do-in-mesa-verde-national-park/
44. Mount Rainier,"Mount Rainier is a glacier-capped, active volcano that can be seen from hundreds of miles away. In the summer months, the lower slopes are carpeted with wildflowers. With its old growth forests and network of hiking trails, this is an outdoor paradise for many travelers. It’s also one of the best hikes to visit if you are an avid hiker.",https://s27363.pcdn.co/wp-content/uploads/2021/06/Mount-Rainier-Itinerary.jpg.optimal.jpg,Washington,"Hike the Skyline Trail, visit Sunrise and hike the Sourdough Ridge Trail, see Myrtle Falls, visit the Grove of the Patriarchs, hike the Wonderland Trail, ride the Mount Rainer Gondola to Crystal Mountain, and hike to a fire lookout tower.",July through September,https://www.earthtrekkers.com/mount-rainier-national-park/
45. New River Gorge,"For millions of years, the New River has been carving out a 73,000 acre gorge in West Virginia. The sandstone cliffs and whitewater rapids create world-class rock climbing and whitewater rafting destinations. Hiking and mountain biking trails wind through the forests, leading to overlooks and historic settlements.",https://s27363.pcdn.co/wp-content/uploads/2021/10/Sandstone-Falls-1.jpg.optimal.jpg,West Virginia,"Do the Bridge Walk, go white water rafting, hike the Long Point Trail, drive Fayette Station Road, go mountain biking and rock climbing, enjoy the view from Grandview Overlook, hike the Castle Rock Trail, and visit Sandstone Falls.",April through November,https://www.earthtrekkers.com/new-river-gorge-national-park-itinerary/
46. North Cascades,"With jagged, snow-capped mountain peaks stretching as far as the eye can see, North Cascades is also called “The American Alps.” At times, it really does look like you are standing in Switzerland.This is one of the most wild, rugged, and remote areas in the lower 48 states. The North Cascades Range, which runs through the park, is the largest glacial system in the United States outside of Alaska. In fact, there are an estimated 300+ glaciers here.This is also consistently one of the least visited national parks in the USA. Despite its close proximity to Seattle, North Cascades National Park was the 4thon the least visited list for 2021, getting only 18,000 visitors.",https://s27363.pcdn.co/wp-content/uploads/2020/09/Diablo-Lake-North-Cascades.jpg.optimal.jpg,Washington,"Go for a scenic drive along North Cascades Highway, hike to Cascade Pass and Sahale Arm, enjoy the views from the Washington Pass Overlook and the Diablo Lake Vista Point, hike the Maple Pass Loop, and visit Stehekin.",June through September,https://www.earthtrekkers.com/north-cascades-national-park/
47. Olympic,"Olympic National Park is one of the most diverse national parks in the United States. In just one national park, you can climb peaks as high as 8,000 feet, walk through old growth temperate rainforests, and stroll along beaches littered with driftwood.",https://s27363.pcdn.co/wp-content/uploads/2022/01/Olympic-National-Park-Photo.jpg.optimal.jpg,Washington,"Go hiking on Hurricane Ridge, photograph the moss dripping from the trees in the Hoh Rainforest, stroll along Rialto Beach until you get to Hole-in-the-Wall, hike to Mount Storm King, see lovely Sol Duc Falls and Marymere Falls, and hike along Shi Shi Beach.",June through September,https://www.earthtrekkers.com/best-things-to-do-in-olympic-national-park/
48. Petrified Forest,"Visiting Petrified Forest National Park is like taking a step back in time. The petrified logs date back hundreds of millions of years, to a time when this land was once lush and fertile. These trees fell and became the mineralized versions of their original forms even before dinosaurs walked the earth.",https://s27363.pcdn.co/wp-content/uploads/2022/04/Petrified-Forest-National-Park-Photo.jpg.optimal.jpg,Arizona,"View the Painted Desert from the overlooks, see the petroglyphs at Newspaper Rock, see the Teepees on Petrified Forest Road, walk the Blue Mesa Trail, hike the Blue Forest Trail, and see the petrified wood at Crystal Forest and along the Giant Logs Trail.",September through May,https://www.earthtrekkers.com/petrified-forest-one-day-itinerary-travel-guide/
49. Pinnacles,Pinnacles National Park preserves and protects the mountains on the eastern end of Salinas Valley. These mountains are the remnants of an extinct volcano. The rocky pinnacles are a popular rock climbing destination and wildflowers in the spring draw the biggest crowds of the year. This park is also one of the few locations where you can spot the California condor in the wild.,https://s27363.pcdn.co/wp-content/uploads/2022/04/Pinnacles-Photo.jpg.optimal.jpg,California,"See the wildflowers in the spring, hike the High Peaks Loop, hike the Bear Gulch Cave Trail, explore the Balconies cave, spot California condors, enjoy the view from Condor Gulch Overlook, and go rock climbing.",October through June,
50. Redwood,"Redwood National and State Parks preserve some of the oldest and largest living creatures on Earth. Some of the redwoods in this park are more than 2,000 years old.This complex of parks (Redwood National Park plus three state parks) protects about 45% of the remaining coastal redwood old-growth forests. These parks are also home to an abundance of wildlife, including black bears, bobcats, coyote, Roosevelt elk, osprey, the Northern spotted owl, flying squirrels, California sea lions, and Pacific gray whales.",https://s27363.pcdn.co/wp-content/uploads/2022/04/Redwood-Forest.jpg.optimal.jpg,California,"Hike Tall Trees Grove, hike through Lady Bird Johnson grove, go for a scenic drive on Newton B. Drury Scenic Byway or Bald Hills Road, visit Fern Canyon, hike the Prairie Creek and Foothill Loop, and go whale watching (November, December, March, April).",All year,
51. Rocky Mountain,"Rocky Mountain National Park is one of the highest national parks in the USA. There are sixty mountain peaks over 12,000 feet and many of these top out over 13,000 feet.",https://s27363.pcdn.co/wp-content/uploads/2021/03/Rocky-Mountain-National-Park-Hike.jpg.optimal.jpg,Colorado,"Drive Trail Ridge Road, hike to Emerald and Dream Lakes, drive Old Fall River Road, hike to Sky Pond or Chasm Lake, take a stroll around Bear Lake, and take your pick from more of the greathikes to do in Rocky Mountain National Park.","All year, but the best time for hiking is June through September",https://www.earthtrekkers.com/best-hikes-in-rocky-mountain-national-park/
52. Saguaro,"This national park is named for the Saguaro Cactus, which only grows in the Sonoran Desert.",https://s27363.pcdn.co/wp-content/uploads/2020/04/Saguaro-.jpg.optimal.jpg,Arizona,"Drive Bajada Loop Drive, walk the Valley View Overlook Trail and the Desert Discovery Nature Trail, see the Signal Hill Petroglyphs, and drive the Cactus Forest Drive. Just outside of the park is the Arizona Sonoran Desert Museum which is well worth the time.",October through April,https://www.earthtrekkers.com/best-things-to-do-in-saguaro-national-park/
53. Sequoia,"At Sequoia National Park, you will walk among towering sequoia trees and see the largest tree in the world, the General Sherman.",https://s27363.pcdn.co/wp-content/uploads/2017/11/Sequoia-National-Park.jpg.optimal.jpg,California,"See the General Sherman Tree, hike Moro Rock, and visit Crescent Meadows.",May through October,https://www.earthtrekkers.com/one-day-itinerary-kings-canyon-and-sequoia-national-parks/
54. Shenandoah,"Shenandoah National Park preserves a section of the Blue Ridge Mountains in Virginia. Skyline Drive is the main thoroughfare through the park, a road that twists and turns for 105 miles from north to south. For those who want to explore the park beyond Skyline Drive, 500 miles of hiking trails travel through the park.",https://s27363.pcdn.co/wp-content/uploads/2022/01/Shenandoah-NP.jpg.optimal.jpg,Virginia,"Drive Skyline Drive and visit the overlooks, hike to the top of Bearfence Mountain, hike Old Rag, visit Dark Hollow Falls, enjoy the view from Hawksbill Mountain, hike to Mary’s Rock, and hike a section of the Appalachian Trail.","May through early November is a great time to visit Shenandoah, when the trees have leaves and the park is lush and green. In May, you can see wildflowers and the end of October is the best time to visit Shenandoah if you want to see fall colors.",https://www.earthtrekkers.com/best-things-to-do-in-shenandoah/
55. Theodore Roosevelt,"Theodore Roosevelt National Park is a picturesque wilderness of grasslands and badlands. Bison, feral horses, and elk roam the landscapes, hiking trails meander through the colorful bentonite hills, and scenic roads take visitors to numerous stunning overlooks.",https://s27363.pcdn.co/wp-content/uploads/2021/11/Bison-in-Theodore-Roosevelt.jpg.optimal.jpg,North Dakota,"Hike the Caprock Coulee Trail, enjoy the view from Sperati Point and the Wind Canyon Trail, drive the Scenic Drive in both units, visit the Petrified Forest, hike the Ekblom and Big Plateau Loop, and visit River Bend Overlook.",May through October,https://www.earthtrekkers.com/best-things-to-do-in-theodore-roosevelt-national-park/
56. Virgin Islands,"With pristine beaches, snorkeling spots, and secluded coves, Virgin Islands National Park is one of the most beautiful parks we have visited.Virgin Islands is one of the few parks that when you are here, it really does feel like you are on vacation. Sip on tropical drinks in the shade of a palm tree, go stand up paddle boarding, visit the historic landmarks, or go for a hike. Or, simply spend all of your time lounging under a palm tree on a white, sandy beach.",https://s27363.pcdn.co/wp-content/uploads/2022/06/Trunk-Bay.jpg.optimal.jpg,US Virgin Islands,"Visit Trunk Bay and snorkel the underwater trail, visit Maho Beach, walk the Leinster Bay Trail and snorkel in Waterlemon Bay, visit the overlooks on North Shore Road, and visit beaches along the north shore of St. John.","All year, but the best time to go is December through March, during the dry season.",https://www.earthtrekkers.com/virgin-islands-national-park/
57. Voyageurs,"Voyageurs National Park protects the waterways, wetlands, and forests in northern Minnesota. This park sits right on the Canadian border and due to its location, the Northern Lights can be seen all year long, even in summer.",https://s27363.pcdn.co/wp-content/uploads/2022/04/Voyageurs.jpg.optimal.jpg,Minnesota,"See the Northern Lights, go fishing, explore the park by houseboat or on a guided tour, see Junction Bay Falls and Kettle Falls, hike the Echo Bay Trail, enjoy the view from Anderson Bay Overlook.",May through October,
58. White Sands,"White Sands National Park is home to the largest gypsum dunefield in the world. These pure white dunes create a fun place to explore, for both kids and adults. Hike out into the dunes, learn about the wildlife that calls this park home, and go sledding on sand as white as the snow.",https://s27363.pcdn.co/wp-content/uploads/2022/03/White-Sands-1.jpg.optimal.jpg,New Mexico,"Drive Dunes Drive, hike the Alkali Flat Trail, go sledding in the gypsum dunes, walk the Dune Life Nature Trail, take a ranger-guided hike, and go backcountry camping.",September through May,https://www.earthtrekkers.com/best-things-to-do-in-white-sands-national-park/
59. Wind Cave,"Wind Cave National Park gets its name for its large, underground cavern and maze of passageways. What many people may not be aware of is that above ground, this park is home to one of the largest prairies in the USA, and with that comes amazing wildlife viewing opportunities.This is a great place to see bison. The herds may not be as large as those you see in Yellowstone or Badlands, but if you choose to go hiking at Wind Cave, there’s a good chance you see bison right from the hiking trails.",https://s27363.pcdn.co/wp-content/uploads/2022/02/Bison-in-Wind-Cave.jpg.optimal.jpg,South Dakota,"Take a cave tour, spot bison from the park roads, hike the Rankin Ridge Trail, and hike the Lookout Point and Centennial Trail Loop.",April through October,https://www.earthtrekkers.com/best-things-to-do-in-wind-cave-national-park/
60. Wrangell - St. Elias,"Take Yellowstone National Park, multiply it by 6, and that’s roughly the size of Wrangell – St. Elias. Throw in four mountain ranges (and some of the tallest peaks in North America), massive glaciers, wildlife, and about 100 miles of road, and you have a rugged, remote, spectacular wilderness to explore.This is one of the most underrated national parks in the United States. Wrangell – St. Elias is full of wonderful adventures. Walk on a glacier, take an ice climbing lesson, hike to the highest peaks, and soar over the mountain ranges in an airplane.",https://s27363.pcdn.co/wp-content/uploads/2022/02/Wrangell-St-Elias-1.jpg.optimal.jpg,Alaska,"Visit McCarthy and Kennecott, hike on the Root Glacier, take a flightseeing tour, visit the Kennecott Mines National Historic Landmark, hike to an abandoned mine, drive Nabesna Road, and explore the backcountry.",June through August,https://www.earthtrekkers.com/wrangell-st-elias-national-park/
61. Yellowstone,"People visit Yellowstone to see its wildlife and natural wonders. Hot springs, thermal pools, and bubbling mud pots can be seen throughout the park. Bison, elk, and bear frequently make appearances along the roads. Waterfalls can also be seen throughout the park and hiking trails lead into the wilderness, away from the busy roads.",https://s27363.pcdn.co/wp-content/uploads/2022/01/Yellowstone-Bison.jpg.optimal.jpg,Wyoming and Montana,"Visit Old Faithful, see the Grand Prismatic Spring, spot wildlife in Lamar and Hayden Valleys, visit the North and South Rims of Grand Canyon of the Yellowstone, hike the short trails in Mammoth Hot Springs and Norris Geyser Basin.",June through October,https://www.earthtrekkers.com/yellowstone-national-park/
62. Yosemite,"Yosemite National Park is home to one of the most iconic landscapes in the United States. Rising from Yosemite Valley are El Capitan and Half Dome. Waterfalls tumble over the granite cliffs, hiking trails weave their way from the valley floor to top of the highest peaks, and massive sequoia trees form a quiet sanctuary within the park.",https://s27363.pcdn.co/wp-content/uploads/2022/05/Yosemite-May.jpg.optimal.jpg,California,"See Bridalveil Falls, hike the Mist Trail to Vernal and Nevada Falls, visit Tuolomne Meadows, hike to the top of Half Dome, enjoy the view from Glacier Point and Tunnel View, hike the Yosemite Falls Trail, visit Taft Point, and visit Mariposa Grove.","To visit Yosemite when all of the park roads are open, plan your visit from mid-May through September. To see the waterfalls at their peak, plan your visit for late spring to early summer.",https://www.earthtrekkers.com/yosemite/
63. Zion,"Zion National Park is a hiker’s paradise. This relatively small park is packed with some of the most thrilling trails in the United States.Hiking definitely tops the to-do list in Zion National Park, but you can also go on a very nice scenic drive, go horseback riding, rock climbing and canyoneering, photograph the extraordinary landscapes, and get a history lesson about this park.",https://s27363.pcdn.co/wp-content/uploads/2022/01/USA-Road-Trip-with-Zion.jpg.optimal.jpg,Utah,"Hike Angels Landing, Observation Point, Hidden Canyon, Riverside Trail, Emerald Pools, Weeping Rock, and Canyon Overlook. One of the best experiences in the park is hiking the Zion Narrows.",Spring and fall for good weather; the winter months for lower crowds,https://www.earthtrekkers.com/zion-national-park/
