Park Name,Description,Image URL,Location,Top Experiences,Best Time to Visit,Guide Link
1. Acadia National Park,"Acadia National Park, also called the “Crown Jewel of the North Atlantic Coast,” protects the rocky coastline in Maine. Granite coastal cliffs, estuary and intertidal habitats, and the tallest mountain on the Atlantic Coast of the United States are found here.",https://s27363.pcdn.co/wp-content/uploads/2022/01/Acadia-National-Park-Photo.jpg.optimal.jpg,Maine,"Drive Park Loop Road, watch the sunrise from Cadillac Mountain, hike the Precipice Trail, visit Sand Beach and Echo Lake, bike the carriage roads, and watch the sunset at Bass Harbor Head Lighthouse.",Mid-April through October,https://www.earthtrekkers.com/acadia-national-park/
2. American Samoa,"Journey to the South Pacific and visit one of the most beautiful US national parks. Because of its remote location, it’s also one of the least visited.This park is spread out over three islands: Tutuila, Ofu, and Ta’u. American Samoa preserves the Samoan culture, tropical rainforests, and coral reefs. It’s the only US national park located in the Southern Hemisphere.",https://s27363.pcdn.co/wp-content/uploads/2023/05/American-Samoa-NP.jpg.optimal.jpg,American Samoa,"Go snorkeling, hike through tropical rainforests, hike the Mount ‘Alava Trail to the summit of Mount ‘Alava, and visit Ofu Beach.","May through September, the dry season in American Samoa.",https://www.earthtrekkers.com/things-to-do-national-park-of-american-samoa/
3. Arches,"Arches is a beautiful wonderland of arches, rock formations, and short hiking trails. Not only will you find over 2,000 arches here, but you will also see hoodoos, fins of sandstone rocks, massive mesas, and balanced rocks.",https://s27363.pcdn.co/wp-content/uploads/2022/05/Arches-March.jpg.optimal.jpg,Utah,"Hike to Delicate Arch, see Balanced Rock and the Fiery Furnace, hike the Devils Garden Trail, visit Double Arch, Turret Arch, and Windows Arch, hike Park Avenue.",The spring and fall months,https://www.earthtrekkers.com/arches-national-park/
4. Badlands,"The colorful buttes, spires, and pinnacles create one of the most photogenic landscapes in the country. Bison and bighorn sheep roam the largest mixed-grass prairie in the United States. The sunrises and sunsets are magical, the hiking trails are short and sweet, and for those looking for more solitude, you can take your pick from a handful of backcountry experiences.",https://s27363.pcdn.co/wp-content/uploads/2022/05/Badlands-National-Park.jpg.optimal.jpg,South Dakota,"Drive Badlands Loop Road and visit the overlooks, watch the sunrise and/or the sunset,hike the Notch Trail,hike the Door and Fossil Exhibit Trails, drive Sage Creek Rim Road, explore the backcountry, hike the Castle Trail, and count how many bison you can find.",Spring and fall,https://www.earthtrekkers.com/notch-trail-badlands-national-park/
5. Big Bend,"Located on the southwestern corner of Texas, within the Chihuahuan Desert, is an extraordinary mountain range that is a haven for hikers, backpackers, and outdoor enthusiasts.This is one of the most remote parks in the lower 48 states, so crowd levels tend to be low all year round. But even when it is at its busiest, Big Bend feels rather quiet.",https://s27363.pcdn.co/wp-content/uploads/2021/05/Best-Hikes-in-Big-Bend.jpg.optimal.jpg,Texas,"Hike the Lost Mine Trail, go star gazing, hike Santa Elena Canyon, go for a drive on Maxwell Scenic Drive, visit Boquillas del Carmen, hike to Balanced Rock, and hike to Emory Peak, the highest peak in the Chisos Mountains.",October through April,https://www.earthtrekkers.com/big-bend-np/
6. Biscayne,"Biscayne National Park is 95% water. This park protects one of the largest reef systems in the world.The best way to explore it is by boat, which makes it very unique from many of the other US national parks. If you love snorkeling, scuba diving, swimming, or simply cruising around by boat, you will love this underrated gem of park.",https://s27363.pcdn.co/wp-content/uploads/2021/12/Biscayne-National-Park-Photo-1.jpg.optimal.jpg,Florida,"Visit Boca Chita Key, go kayaking or paddle boarding in Jones Lagoon, snorkel or scuba dive along the Maritime Heritage Trail, visit Elliott Key, go snorkeling at Fowey Rocks Lighthouse, and cruise through Stiltsville.",October through April,https://www.earthtrekkers.com/best-things-to-do-in-biscayne-national-park/
7. Black Canyon of the Gunnison,"In some ways, the Black Canyon of the Gunnison is a smaller version of the Grand Canyon. You can visit both the North and South Rims, enjoy the views from the overlooks, and, for the ultimate adventure, hike below the rim to the Gunnison River.",https://s27363.pcdn.co/wp-content/uploads/2022/06/Painted-Wall-Viewpoint.jpg.optimal.jpg,Colorado,"Drive South Rim Road and visit the overlooks, hike along the South Rim, drive East Portal Road, visit Exclamation Point, hike an inner canyon route, drive North Rim Road and visit the overlooks.","April through October, when the weather is warm and the park roads are open.",https://www.earthtrekkers.com/black-canyon-of-the-gunnison-national-park/
8. Bryce Canyon,"This is an extraordinary place to visit and its unique landscape sets it apart from other national parks. Although Bryce Canyon may not have the same sweeping, expansive vistas as the Grand Canyon, it’s still a breathtaking experience the first time you see this view.",https://s27363.pcdn.co/wp-content/uploads/2022/05/Bryce-Canyon-National-Park-Guide.jpg.optimal.jpg,Utah,"Some of the best viewpoints are right along the rim, which are easily accessible by car or the shuttle: Sunrise Point, Sunset Point, Inspiration Point, and Bryce Point. Hike the Queens Garden and Navajo Loop, a 3-mile hike past some of the best scenery in the park. Rainbow Point and Yovimpa Point are also nice viewpoints.",Spring and fall,https://www.earthtrekkers.com/bryce-canyon-national-park/
9. Canyonlands,"Canyonlands National Park is one of our favorite national parks in the USA. Why? The landscapes, the hiking trails, and the off the beaten path experiences make this one of the top parks for those who crave adventure.",https://s27363.pcdn.co/wp-content/uploads/2021/10/Mesa-Arch-1.jpg.optimal.jpg,Utah,"Visit the overlooks on Island in the Sky, watch the sunrise at Mesa Arch, go hiking in The Needles, drive Shafer Canyon Road, hike below the rim of the Island in the Sky mesa, drive the White Rim Road, explore The Maze.",Spring and fall,https://www.earthtrekkers.com/canyonlands-national-park/
10. Capitol Reef,"This national park is full of many wonderful surprises. With an amazing scenic drive, hiking trails that rival those in Zion, rugged, remote areas to explore by 4×4, short, easy slot canyons, historical landmarks, and even delicious pie, this is another one of our favorite national parks.",https://s27363.pcdn.co/wp-content/uploads/2022/04/Capitol-Reef-National-Park-Road-1.jpg.optimal.jpg,Utah,"Drive the 16-mile round-trip drive along Scenic Drive, drive Capitol Gorge Road, hike to Hickman Bridge, and watch the sunset from Sunset Point, hike to Cassidy Arch, drive the Cathedral Valley Loop, and Loop the Fold.",Spring and fall,https://www.earthtrekkers.com/capitol-reef-national-park/
11. Carlsbad Caverns,"Carlsbad Caverns National Park is an underground fantasy land of limestone chambers, stalactites and stalagmites, and long, twisting tunnels.",https://s27363.pcdn.co/wp-content/uploads/2020/12/Carlsbad-Caverns.jpg.optimal.jpg,New Mexico,"Tour the caverns on your own or on a ranger-guided tour. You can also go star gazing, hike a surface trail, or go on a scenic drive.",May through October,https://www.earthtrekkers.com/things-to-do-in-carlsbad-caverns/
12. Channel Islands,"Channel Islands National Park preserves five of the eight Channel Islands. This archipelago sits off the California coast, not far from Los Angeles.",https://s27363.pcdn.co/wp-content/uploads/2022/04/Channel-Islands.jpg.optimal.jpg,California,"Go snorkeling, whale watching, hiking, kayaking, swimming, wildlife watching, and sailing.","All year, but summer is the best time to visit the park if you want to participate in water sports like kayaking, snorkeling, and scuba diving. This is also the busiest time to visit the park.",
13. Congaree,"Congaree National Park protects the oldest old-growth bottomland hardwood forest in the southeastern United States. This small park is quick and easy to visit. Walk the boardwalk trail through the forest, go kayaking or canoeing on Cedar Creek, go birdwatching and fishing, and, if you like, venture farther into the park on a number of other woodland trails.",https://s27363.pcdn.co/wp-content/uploads/2021/11/One-Day-in-Congaree-Photo.jpg.optimal.jpg,South Carolina,"Walk the Boardwalk Loop Trail, go canoeing or kayaking on Cedar Creek, go on a multi-day canoeing trip on the Congaree River, hike the Weston Loop Trail, and hike to the General Greene Tree.",The best time to visit Congaree National Park is in the spring and the fall.,https://www.earthtrekkers.com/one-day-in-congaree-national-park/
14. Crater Lake,"Crater Lake is what remains of Mount Mazama, a volcano that erupted almost 8,000 years ago, and then collapsed. The remaining caldera filled with water, forming the deepest lake in the United States.",https://s27363.pcdn.co/wp-content/uploads/2022/04/Crater-Lake.jpg.optimal.jpg,Oregon,"Drive Rim Drive around Crater Lake, take a boat tour of Crater Lake, visit Wizard Island, hike the trails along the rim, and go camping.","Mid-July through early October, when all of the park roads are open.",
15. Cuyahoga Valley,"Cuyahoga Valley National Park preserves a lush river valley that is home to both natural and historical sites. Among the thousands of acres of forests and wetlands are a network of hiking and biking trails. Visit a covered bridge, ride a train through the heart of the park, learn about the Ohio and Erie Canal, and photograph the waterfalls.",https://s27363.pcdn.co/wp-content/uploads/2021/05/Things-to-do-Cuyahoga-Valley.jpg.optimal.jpg,Ohio,"Photograph Brandywine Falls, hike, bike or run the Ohio and Erie Towpath Trail, visit Beaver Marsh, go for a ride on the Cuyahoga Valley Scenic Railroad, visit Bridal Veil Falls, visit Deer Lick Cave, hike to Blue Hen Falls, visit the Everett Covered Bridge, and hike the Ledges Trail.",May through October is a beautiful time to visit the park.,https://www.earthtrekkers.com/best-things-to-do-in-cuyahoga-valley-national-park/
16. Death Valley,"Stand in Badwater Basin, the lowest point in the United States. Visit Furnace Creek, which holds the record for the hottest recorded temperature in the world. Take in the view from Dante’s Peak, slide down the sand dunes, explore narrow canyons, and journey out to Racetrack Playa, where boulders mysteriously slide across the desert landscape.",https://s27363.pcdn.co/wp-content/uploads/2020/11/Death-Valley-Sunset.jpg.optimal.jpg,California,"Visit Zabriskie Point, drive Artist’s Drive, visit Badwater Basin, enjoy the view from Dante’s View, visit Ubehebe Crater, drive to Racetrack Playa, hike to Telescope Peak, slide down the Mesquite Flat Sand Dunes, and view the night sky.","November through March, when the weather is mild.",https://www.earthtrekkers.com/death-valley-national-park/
17. Denali,"Denali National Park, one of the largest national parks in the USA, is home to millions of acres of remote, rugged wilderness. It is named for Denali, the tallest mountain in North America, and catching a view of this mountain peak is one of the best things to do in Denali National Park.",https://s27363.pcdn.co/wp-content/uploads/2022/05/Denali-July.jpg.optimal.jpg,Alaska,"Ride one of the park shuttles to the end of Denali Park Road, take aflightseeing tour,go hiking in the Savage River area of the park, visit the sled dog kennels, hike into the backcountry,visit Eielson, spend some time in Kantishna, take your pick from of many hiking trails in the park, and climb to the summit of Denali.","June through September, when the weather is warm and the roads are open.",https://www.earthtrekkers.com/denali-flightseeing-tour/
18. Dry Tortugas,"Located 70 miles west of Key West, Dry Tortugas National Park makes up the last few islands of the Florida Keys.",https://s27363.pcdn.co/wp-content/uploads/2022/05/Dry-Tortugas-January.jpg.optimal.jpg,Florida,"Explore Fort Jefferson, go snorkeling or swimming, visit Loggerhead Key, and take a stroll on Bush Key.","All year, but it is best to avoid hurricane season (July through October).",https://www.earthtrekkers.com/dry-tortugas-national-park/
19. Everglades,"Everglades is the most popular national park to visit in Florida, since it is easy to get to and easy to visit. In just one day, you can hike a few short trails, spot manatees and crocodiles, and go on an airboat ride.",https://s27363.pcdn.co/wp-content/uploads/2018/12/Everglades.jpg.optimal.jpg,Florida,"Walk the Anhinga Trail, visit the Flamingo Visitor Center and see if you can spot crocodiles or manatees, walk the boardwalk trail at Mahogany Hammock, take a kayaking tour, and bike through Shark Valley.","November through March, when temperatures are mild.",https://www.earthtrekkers.com/one-day-in-everglades-national-park/
20. Gates of the Arctic,"Gates of the Arctic National Park & Preserve is the least visited national park in the USA. Located in Alaska, this wild, remote national park is home to one of the most untouched wilderness areas in the country.No roads lead into Gates of the Arctic. There aren’t even any maintained hiking trails.Most of the travelers who visit this park do so on a guided tour, either kayaking or hiking through the park. For those who love the idea of exploring a remote wilderness, filled with wildlife and beautiful landscapes, this a park that belongs on the top of your list.",https://s27363.pcdn.co/wp-content/uploads/2022/04/Gates-of-the-Arctic.jpg.optimal.jpg,Alaska,"Go hiking, take a float trip, go canoeing or rafting on the Kobuk and Noatak Rivers, go fishing, and go backpacking.",June through September,
21. Gateway Arch,"Gateway Arch, located in St. Louis, Missouri, is a famous American icon. Since its completion in the 1960’s, the Arch has been attracting thousands of visitors every year.",https://s27363.pcdn.co/wp-content/uploads/2019/12/Gateway-Arch.jpg.optimal.jpg,Missouri,"Ride the tram to the top of Gateway Arch, watch the Monument to the Dream Documentary, visit the museum exhibits, visit the Old Courthouse, and see the Old Cathedral.",All year,https://www.earthtrekkers.com/how-to-visit-gateway-arch-national-park-st-louis/
22. Glacier Bay,"At 3 million acres, Glacier Bay is one of the larger US national parks. This park protects a portion of the Inside Passage and its fjords, glaciers, and temperate rainforest.No roads lead into this park, so to get here, you will either have to fly or take a cruise. Cruises are one of the best ways to experience this park, as you drift past glaciers and take excursions to seaside towns and hiking trails.",https://s27363.pcdn.co/wp-content/uploads/2022/04/Glacier-Bay-Calving.jpg.optimal.jpg,Alaska,"Explore Bartlett Cove, go sport fishing, take a flightseeing tour or kayaking tour, see the glaciers, and go hiking in Bartlett Cove.",The summer months are the best time to visit Glacier Bay National Park.,
23. Glacier,"With glacier-capped mountains, dazzling aquamarine lakes, and some of the most exciting hiking trails in the country, it’s no wonder that Glacier National Park is called the “Crown of the Continent.”Drive Going-to-the-Sun Road, one of the best scenic drives in the United States. Along the way, you get jaw-dropping views from the overlooks as the road twists and turns through the mountains. You can also take your pick from a long list of hiking trails, go kayaking, and count how many mountain goats you spot.",https://s27363.pcdn.co/wp-content/uploads/2022/01/Glacier-National-Park.jpg.optimal.jpg,Montana,"Drive Going-to-the-Sun Road, visit Many Glacier, hike to Grinnell Glacier and Hidden Lake, visit Logan Pass, hike the Highline Trail, visit Two Medicine, see Wild Goose Island, and spend some time at Lake McDonald.","July through September, when Going-to-the-Sun Road is open.",https://www.earthtrekkers.com/glacier-national-park/
24. Grand Canyon,Grand Canyon National Park is one of the most visited parks in the USA. People from all over the world travel here to see this place. The Grand Canyon is one of the Seven Natural Wonders of the World and a UNESCO World Heritage Site.,https://s27363.pcdn.co/wp-content/uploads/2022/01/Grand-Canyon-USA-Road-Trip.jpg.optimal.jpg,Arizona,"Visit the South Rim viewpoints, watch the sunrise and/or sunset, hike below the rim, take a flightseeing tour by airplane or helicopter, visit the North Rim, and hike the rim-to-rim trail.",All year but spring and fall have the mildest weather.,https://www.earthtrekkers.com/grand-canyon-national-park/
25. Grand Teton,"If you like hiking, Grand Teton is one of top parks to visit in the USA. Hiking trails lead deep into the Teton Range, to some of the highest peaks in the park, and to beautiful lakes.Grand Teton is also a top pick for photographers. Ansel Adams was a frequent visitor here, photographing the Teton Range and the Snake River. Oxbow Bend is a great place to photograph wildlife and Mormon Row makes a prime sunrise photography spot.",https://s27363.pcdn.co/wp-content/uploads/2021/02/Schwabacher-Landing.jpg.optimal.jpg,Wyoming,"Visit Jenny Lake, hike to Inspiration Point and Hidden Falls, visit Mormon Row and Schwabacher Landing, visit Oxbow Bend at sunrise, visit the Laurance S. Rockefeller Preserve, and hike the trails that run in and along the Teton Range.",Mid-May through October,https://www.earthtrekkers.com/grand-teton-national-park/
26. Great Basin,"This park preserves the Lehman Caves and Wheeler Peak, the second highest peak in Nevada. Also found in the park are groves of bristlecone pines, which are some of the oldest species on the planet.Despite its location in eastern Nevada, not far fromUtah’s Mighty 5,Great Basin is one of the least visited national parks in the USA.",https://s27363.pcdn.co/wp-content/uploads/2022/04/Great-Basin.jpg.optimal.jpg,Nevada,"Hike to the top of Wheeler Peak, take a tour of Lehman Caves, drive Wheeler Peak Scenic Drive, hike the Bristlecone Trail, go star gazing, and hike the Alpine Lakes Loop Trail.",Mid-June through October,https://www.earthtrekkers.com/utah-mighty-5-travel-guide-and-road-trip-itinerary/
27. Great Sand Dunes,"Great Sand Dunes National Park is one of those parks that is pure fun to visit. Sure, there are a few hikes to do, but the best experience is to go sandboarding or sand sledding on the dunes.",https://s27363.pcdn.co/wp-content/uploads/2021/03/Great-Sand-Dunes.jpg.optimal.jpg,Colorado,"Go sandboarding or sledding, hike on the dunes, watch the sunset, camp on the dunes, go stargazing, hike to Star Dune, drive the Medano Pass Primitive Road, and hike to Zapata Falls.",This park can be visited all year. The spring and the fall have the mildest weather.,https://www.earthtrekkers.com/best-things-to-do-great-sand-dunes/
28. Great Smoky Mountains,Great Smoky Mountains National Park straddles the border between Tennessee and North Carolina. The ridgeline of the Great Smoky Mountains runs through the center of the park and it is here that you will find some of the tallest peaks in eastern North America.,https://s27363.pcdn.co/wp-content/uploads/2022/01/Great-Smoky-Mountains-Cabin.jpg.optimal.jpg,Tennessee and North Carolina,"Enjoy the view from Clingman’s Dome and Newfound Gap, hike the Alum Trail to Mount LeConte, drive through Cades Cove, and drive the Roaring Fork Motor Trail.","April through November, when the temperature is mild and the trees have leaves (or are at least starting to bloom)",https://www.earthtrekkers.com/weekend-gatlinburg-great-smoky-mountains-national-park/
29. Guadalupe Mountains,"Guadalupe Mountains National Park is located in Texas. Canyons, gypsum sand dunes, fossilized coral reefs, and some of the highest peaks in Texas are all things that you can see in Guadalupe Mountains National Park.",https://s27363.pcdn.co/wp-content/uploads/2022/03/McKittrick-Canyon-Trailhead.jpg.optimal.jpg,Texas,"Hike to the top of Guadalupe Peak, the highest point in Texas. Visit the Salt Basin Dunes, hike to Devil’s Hall, visit El Capitan Lookout, hike the McKittrick Canyon Trail or the Permian Reef Trail, and visit Dog Canyon.",September through May,https://www.earthtrekkers.com/best-things-to-do-in-guadalupe-mountains-national-park/
30. Haleakala,"Haleakala is a massive volcano that makes up more than 75% of the island of Maui.Watching the sun rise above the clouds and hiking into the crater are two of the best things to do in Haleakala National Park, but there is more to this park than visiting the summit of a volcano. You can also visit the lush forests and waterfalls in the Kīpahulu District, which is located along the Road to Hana.",https://s27363.pcdn.co/wp-content/uploads/2022/04/Hiking-in-Haleakala.jpg.optimal.jpg,Hawaii,"Watch the sunrise above the clouds, hike the Sliding Sands Trail, visit the viewpoints on the Haleakala summit, hike the Pīpīwai Trail, visit the Seven Sacred Pools of ‘Ohe’o, and go stargazing.",All year,https://www.earthtrekkers.com/best-things-to-do-in-haleakala-national-park/
31. Hawai'i Volcanoes,"Hawai’i Volcanoes National Park is home to two of the world’s most active volcanoes, Mauna Loa and Kīlauea. You also have the chance to catch Kīlauea in action, as molten lava oozes up from below the Earth’s crust.",https://s27363.pcdn.co/wp-content/uploads/2022/06/Hawaii-Volcanoes.jpg.optimal.jpg,Hawaii,"See the lava flow, drive Crater Rim Drive and visit the viewpoints, hike the Kīlauea Iki Trail, drive Chain of Craters Road, hike out to the Pu’uloa Petroglyphs, and walk through the Thurston Lava Tube.",All year,https://www.earthtrekkers.com/best-things-to-do-in-hawaii-volcanoes-national-park/
32. Hot Springs,"Hot Springs National Park is one of the most accessible national parks in the US. This land was set aside in the 1800’s to preserve the hot springs, which were believed to have medicinal properties. Soaking in these hot springs is the best thing to do on a visit to this park, but you can also go hiking, biking, and birding.",https://s27363.pcdn.co/wp-content/uploads/2022/04/Hot-Springs-Bridge.jpg.optimal.jpg,Arkansas,"Soak in the hot springs, visit Bathhouse Row, hike the Goat Rock Trail, hike the West Mountain Trail, go biking through the park, and see Balanced Rock.","The park can be visited all year, but the weather is the best for outdoor activities May through October.",
33. Indiana Dunes,"This has been a popular beach destination for decades, but it is also one of the most biodiverse national parks in the USA. Exploring the sand dunes and relaxing on the beach are two of the best things to do in Indiana Dunes National Park, but hiking and bird watching are also top experiences in the park.",https://s27363.pcdn.co/wp-content/uploads/2022/05/Indiana-Dunes-Hiking.jpg.optimal.jpg,Indiana,"Relax on the beach, hike the Dunes Succession Trail , go bird watching, and visit Indiana Dunes State Park.","May through September is the best time to go, for warm weather. If you like birding, May and October are top months to visit the park.",https://www.earthtrekkers.com/best-things-to-do-in-indiana-dunes/
34. Isle Royale,"Isle Royale is an archipelago of over 400 islands. It’s remote location in northern Michigan makes in one of the least visited national parks in the USA. Top experiences include backpacking and camping, fishing, canoeing, and kayaking.",https://s27363.pcdn.co/wp-content/uploads/2022/04/Isle-Royale.jpg.optimal.jpg,Michigan,"Ride the ferry to Isle Royale (the main island in the park), hike the 150+ miles in the park, go on a multi-day backpacking trip, go canoeing or kayaking, go fishing, and keep an eye out for moose.",June through October,
35. Joshua Tree,"With its desert scenery, hiking trails, rock climbing routes, hidden oases, scenic drives, and trees that look like they have been plucked from the pages of a Dr. Seuss book, Joshua Tree National Park is a joy to explore.",https://s27363.pcdn.co/wp-content/uploads/2022/03/Joshua-Tree.jpg.optimal.jpg,California,"Hike theHall of Horrors,see Skull Rock, explore Hidden Valley, hike to an oasis, hike to Arch Rock and Heart Rock, drive Geology Tour Road, visit the Cholla Cactus Garden, and go stargazing.",October through May,https://www.earthtrekkers.com/how-to-hike-the-hall-of-horrors/
36. Katmai,"Katmai istheplace to watch brown bears feasting on salmon. Every July, the salmon make a run up the Brooks River. Hundreds of brown bears arrive at Brooks Falls to fatten up on these fish, in preparation for the upcoming winter hibernation season. Watching this in action is one of the most unique national park experiences.",https://s27363.pcdn.co/wp-content/uploads/2023/07/Brooks-Falls-Katmai-National-Park-1.jpg.optimal.jpg,Alaska,"Bear watching at Brooks Falls,day trip to the Valley of Ten Thousand Smokes, go fishing, take a flightseeing tour, visit Naknek Lake, hike to the top of Dumpling Mountain.",late June through mid-September. July is typically the best month to watch the bears feasting on salmon.,https://www.earthtrekkers.com/valley-of-ten-thousand-smokes/
